{
  "font": {
    "name": "JetBrains Mono",
    "links": [
      "https://www.jetbrains.com/lp/mono/"
    ],
    "license": "open"
  },
  "theme": {
    "name": "Gruvbox Dark Hard",
    "links": [
      "https://github.com/morhetz/gruvbox"
    ],
    "license": "open",
    "appearance": "dark"
  },
  "snapshot": "jetbrains-mono--gruvbox-dark-hard.png",
  "editors": [
    {
      "id": "vscode",
      "settings": "{\n  \"editor.fontFamily\": \"JetBrains Mono\",\n  \"editor.fontSize\": 14,\n  \"editor.fontWeight\": \"400\",\n  \"editor.lineHeight\": 1.5,\n  \"editor.fontLigatures\": true,\n  \"workbench.colorTheme\": \"Gruvbox Dark Hard\"\n}"
    },
    {
      "id": "zed",
      "settings": "{\n  \"buffer_font_family\": \"JetBrains Mono\",\n  \"buffer_font_size\": 14,\n  \"buffer_font_weight\": 400,\n  \"buffer_line_height\": {\n    \"custom\": 1.5\n  },\n  \"buffer_font_features\": {\n    \"calt\": true\n  },\n  \"theme\": \"Gruvbox Dark Hard\"\n}"
    }
  ]
}
