{
  "font": {
    "name": "Input Mono",
    "links": [
      "https://input.djr.com/"
    ],
    "license": "free"
  },
  "theme": {
    "name": "Nord",
    "links": [
      "https://marketplace.visualstudio.com/items?itemName=arcticicestudio.nord-visual-studio-code"
    ],
    "license": "open",
    "appearance": "dark"
  },
  "snapshot": "input-mono--nord.png",
  "editors": [
    {
      "id": "vscode",
      "settings": "{\n  \"editor.fontFamily\": \"Input Mono\",\n  \"editor.fontSize\": 14,\n  \"editor.fontWeight\": \"400\",\n  \"editor.lineHeight\": 1.5,\n  \"editor.fontLigatures\": true,\n  \"workbench.colorTheme\": \"Nord\"\n}"
    }
  ]
}
